label,text
教育,十年寒窗遭遇美国大学毕业生就业低潮据世界日报报道，寒窗苦读熬出头，今年的毕业生们却面临极为艰巨的就业前景。根据全美大学与雇主协会(National Association of Colleges and Employers)针对2009年毕业生所做的研究报告，今年雇主雇用的毕业生，比去年减少22%。11日将从纽约大学社工学院毕业的华裔学生江冬娴，两年前在纽约市立大学杭特学院获得心理学学士学位，在一家专门服务华裔的居住小区组织找到实习任务，她当时有机会获得该组织提供的社工任务，为华人服务也是她的理想之一。不过由于申请H1B任务签证名额紧缺，她失去了任务机会。江冬娴转而回学校继续深造，她被纽约大学社工学院录取，16个月完成硕士学位，但今年毕业时又碰上金融危机和经济衰退，就业市场极不景气。在试穿毕业袍时，还没一家公司正式同意她的任务申请。她表示，就业不景气，唯一让她仍保持希望的是自己有中英文双语专长，而且是华裔移民居住小区需求日益增加的社工领域。她只希望未来几个月内找任务时，人们对华裔社工的需求胜过削减经费的阻力。刚从费城天普大学体育管理系毕业的兰德斯(Justin Landis)，在曼哈坦麦迪臣广场花园(Madison Square Garden)完成实习后，就业机会渺茫。仍保持乐观心态的兰德斯表示，他有两手准备，经济景气急转直下时，他就申请了佛州大学企业管理硕士项目。他说，如果没有较好的就业机会，他秋季就去读书，趁经济不景气时充实自己，两年后毕业，找到好任务的机会一定会增加。根据全美大学与雇主协会的统计，今年毕业生手上已经有任务的比率比过去几年大幅下降。2007年毕业的大学生毕业时51%已有任务，2008年下降到26%，今年骤减到19.5%。也就是说，今年的大学毕业生，每五个人中，找到任务的还不到一人。除了找任务机会减少外，那些被用人机构接受的幸运儿，薪水也比以前缩水。2008年大学毕业生平均薪水为4万9624元，今年是4万8155元。
教育,困顿相识：美国一对流浪者举行婚礼(图)丹特·怀特是个流浪汉。他在美国首都华盛顿街头“讨生活”时遇见同样无家可归的尼亚妮·切斯纳特，两人坠入爱河。相恋多年后，这两名吃了上顿没下顿的流浪者上星期在好心人帮助下举行梦幻婚礼，结为夫妻。困顿相识怀特现年29岁，14岁开始流落华盛顿街头。他从没想过，自己有朝一日能与一个爱的人结婚。然而就在本月2日，他与39岁的切斯纳特结为“流浪”夫妻。切斯纳特说，她因酗酒和吸毒而流落街头，“我基本上是吃了上顿没下顿，努力活下去，然后我就遇见了他”。切斯纳特8日对法新社说：“我们一见面就很谈得来，好像有化学作用一样。那是在9年前。”她说，两人从此之后就一直在一起，“我们老在一块聊天”。每逢星期六，怀特和切斯纳特喜欢一道去乔治敦一家教堂。这家教堂为无家可归者提供免费午餐。他们还可以在这里听牧师讲课。几个月前，怀特告诉一名经常来教堂的当地居民，他希望自己能有点积蓄，负担得起一场婚礼，和切斯纳特永结同心。这名居民将此事同朋友们讲了之后，大家觉得可以帮怀特一把。居民玛格丽特·戴维斯说：“所有人都认为，你不用非要等有了钱才结婚。”梦幻婚礼戴维斯说，不少常来教堂的当地居民决定帮助怀特实现结婚的愿望，“有人负责提供花，我帮忙提供了戒指，一个姑娘帮他们制作蛋糕，还有人帮忙买来礼服。”除了这些，还有一名教堂常客为怀特和切斯纳特在弗吉尼亚州一家五星级饭店预付两天房费，供他们度蜜月。有了这些好心人帮助，怀特终能与切斯纳特走入婚姻殿堂。2日婚礼那天，新郎身着黑色礼服，内穿粉红色缎子背心，打着领带；新娘身穿白色婚纱，手捧粉红色鲜花。为他们主持结婚仪式的牧师约翰·格雷厄姆说，两人都很紧张。结婚仪式过后，新人在教堂外和众人合影，两人恩爱地喂对方吃巧克力蛋糕。在现场乐队伴奏下，他们跳了相识之后的第一支舞。“这比我想像中的更加美好，这就是我梦中的婚礼，”新娘说。
教育,日本“震经”总结：让防灾成为习惯在日本，几乎每月的第一天都被设定为公益纪念日，最有意思的要算9月1日的防灾日了。这一天，各地都要组织防灾训练，大大小小的消防单位或在购物中心的广场，或在公园空地搭起帐篷，里面放置模拟火灾和地震现场的设备，外面摆出一排灭火器。消防员带领市民体验灾害来临时的情景。有时还会看到身手敏捷的消防员爬到一根细细的长竿顶上，表演各种高难度动作。上班族和学生这一天都放假。家长会带着小孩去钻一下模拟火灾的“浓烟走廊”、感受“8级地震”的剧烈晃动，或者排队学爬云梯，防灾训练演习就像逛游乐园一样新鲜有趣。这一天，中央和地方政府都会按法规认真地把灾害预警系统检查运行一遍，政府官员甚至还会带着安全帽出现在电视里，作一番“紧急指示”。作为外国人，刚开始只是觉得有趣，后来才感到其中的深意。1923年9月1日，日本发生关东大地震，死亡和失踪14万余人，是日本近代最惨烈的地震，许多人因地震引起的火灾等二次伤害致死。防灾日就是为纪念这次天灾，于1982年5月确立了下来。天灾留给人们最直接的后遗症是持久、巨大的伤痛。人们灾后初期纪念的主题主要是哀悼。到1982年，亲身经历过关东大地震的日本人已经很少，这个时候纪念的主题就转向吸取教训、早做准备、冷静面对。上世纪90年代以后，灾后重建工作中的防灾与减灾逐渐成为最紧迫的主题。笔者2005年采访神户大地震10周年纪念活动时，主办方介绍了10年来政府和社会各界作出的防灾与减灾成绩：地下修建了坚固的“共同沟”，安放水电、煤气等生命线设备；政府先后制定或修改了10部法律，从建筑标准、灾害警报等各个方面指导全国的防震工作；在所有地方自治体推广“防灾GIS”地图信息管理软件；实施“灾害指挥”首长特训，培养政府首脑亲自操作、启动防灾系统的能力；帮助企业以各种方式做好应急财政或生产资料准备，灾后恢复生产……从城建、行政、经济等各方面共同努力，建设一个“耐震”型社会来抵御地震的风险。地震无法阻挡，以生命为代价换来的经验却可以帮助人们更有效地应对灾难。防灾日不仅培养了应对自然灾害的技能，更重要的还在增强人们的防灾意识。让防灾成为习惯，这也是对罹难者的一种纪念。(曹鹏程)
教育,独家：与利兹大学校方代表对话英国教育朱莉亚：有的院系的奖学金的选拔过程是他自己内部进行的，你一申请了以后，就自动考虑给不给你奖学金，根据你的背景情况。有的院系是希望你申请，要填一个单独的奖学金申请表。主持人：要不要申请奖学金这个项目。朱莉亚：这要提醒同学要在网络上看一下，因为不同的院系可能要求不一样。主持人：所以这位想申请利兹大学翻译专业的同学，也要在利兹大学的网站上尤其是专业下面的说明里看清楚，上面会有关于奖学金申请以及各种申请的详细介绍。网友：我现在已经收到了利兹大学的Offer，学传媒，而且决定要去利兹大学了，但是不知道在学习期间，利兹大学是否安全。主持人：可能是考虑安全方面的问题，因为据我所知英国那些学校是没有校园的，同学们上课相对来说比较自由，跟中国还是不太一样。陈昆：我们首先恭喜这位同学已经收到了Offer，读传媒的课程能够被录取是不容易的，相信这位同学是很优秀的。关于利兹是不是安全，我们在网上也看到很多不同的说法，可以查一下，基本上我们认为利兹是安全的城市，没问题的。但是任何一个大城市都会有这样或那样的事，可能一些个人在利兹会有一些不愉快的经验，就像在任何地方会发生不愉快的经验一样，可能会在网上或者在其它地方表露出来。总体来讲，利兹是一个很安全的城市，在晚上我自己本人曾经11、12点钟走过火车站前面最乱的一条路，没有任何问题。利兹大学的校园，我们跟很多英国大学不一样，我们是一个有校园的大学，而且我们的校园是在市区中心的校园，和中国很多校园型的大学很相近，所以对于大多数同学来讲，利兹大学是很容易适应的一个校园，我们给学生提供一个安全、安静的学习和生活环境。主持人：所以有对安全问题疑虑的这些同学尽可放心，利兹大学的校园环境，包括利兹整个城市的环境跟中国也是蛮接近的。朱莉亚：对，因为前年英国曾经在国内做过这样一个民意测验，最后的结果出来利兹是英国被评为第二个最适合抚养小孩的城市。一个是因为这个城市本身的绿化情况特别好，还有是跟它的安全有很大的关系。当然这有一个文化差异问题，我估计很多同学在英国有一些不好的经历，可能是由于自己的安全意识不好。比如说在英国，不管你走到哪一个城市，首先要养成一个习惯，出门一定要关窗户。主持人：在中国也是一样的。朱莉亚：对，如果你把窗户打开，就表明你叫人家来犯罪，而且你把窗户打开，还把你的东西放在桌子上。还有对女同学来说，因为英国大家也知道，是一个酒文化很强的国家，总是会有很多人喝酒，我还是觉得女同学最好晚上不要到处走，最好还是结伴而行，下了晚自习直接回家，自己要养成一个好的注意安全的习惯。主持人：同学们只身一人留学海外首先要养成安全意识，一种自我保护的意识，像刚才朱莉亚提醒我们的几点，只要提高自我警惕，利兹这个城市包括利兹大学还是一个非常安全的地方。我们刚才三位也都向大家介绍了，由于英镑兑人民币汇率的变化，留学英国的趋势是逐步看好，逐渐看好，宋丹女士是一线工作者，肯定对这方面更有发言权，能不能给现在观看我们节目准备留学的同学一些建议，他们应该做好哪些行程的准备？宋丹：我就先从申请Offer这块来说，如果计划明年出国的同学尽早申请，像利兹大学这么好的大学，都是先到先得，你申请的比较早，你的条件比较符合，学校给你Offer的可能性越大。对于今年要走的同学，我提几点建议，首先你需要到利兹大学的网站或者是到EIC的网站去看，我们有非常详细的行前指导的一个专栏，利兹大学有非常详细的介绍，大家可以根据上面逐条列出的东西去准备自己要去英国需要的一些东西和注意点，详细的情况也可以登录网站或者是打电话到我们公司，或者是跟陈老师联系都可以。
教育,美国室友的独到见解：中国人都会功夫(图)那一年我去美国旅游，为了节省住宿费，我没住酒店，在加利福尼亚州的一个小镇上跟几个美国人合租一套公寓。那里在举办中国文化节，举办方在镇里的歌剧院组织了京剧、中国民乐表演，在镇中心广场舞起了狮子，当地电视台在晚间放映中国功夫片，比如《精武门》、《少林寺》和《太极张三丰》。一天晚上，几个美国室友打算出去逛逛。公寓管理员琼斯太太说，最近镇上治安不太好，劝大家别出去。杰克指着我说：“没事，我们这里有中国人。”我们一行4人果然遇到了麻烦。过一条马路时，一辆轿车在我们不远处来了个急刹车，从车上跳下几个凶神恶煞的人，指责我们横穿马路致使他们急刹车，车里有人受了伤，要我们赔钱。我们知道遇到无赖了，非常气愤。那几个凶神恶煞的想动手。这时，杰克指着我说：“你们要知道，他是中国人。”然后对我说：“朋友，现在是你显身手的时候了！”众人的目光集中到我身上，我暗暗叫苦。虽说是赶鸭子上架，可我不能给中国人丢脸。情急之下，我想起老爸练太极拳的一个招式——“白鹤亮翅”。我学着老爸摆好了姿势。“中国功夫！”看到我这架式，对方大叫。其中一个一声招呼，他们灰溜溜地把车开走了。“何先生，怎么不教训他们一下？”杰克问。“他们中随便一个人都可以把我打趴下！”我心有余悸。“什么？作为中国人，你不会中国功夫吗？”大家非常惊讶。室友们这些天一直在看中国功夫片，认为只要是中国人，就会中国功夫。
财经,"新增资金入场 沪胶强势创年内新高记者 魏曙光本报讯 上海天然橡胶期价周三再创年内新高，主力合约突破21000元/吨重要关口。分析师指出，由于橡胶现货需求强劲，但供应却因主产国降雨天气而紧俏。同时国内有望出台新汽车刺激方案，沪胶后市有望延续强势。经过两个交易日的强势调整后，昨日上海天然橡胶期货价格再度大幅上扬，在收盘前1小时，大量场外资金涌入，主力1003合约强劲飙升很快升穿21000 元/吨整数关口，终盘报收于21,400元/吨，上涨2.27%，较前一日结算价上涨475元/吨，成交量为736,816手，持仓量为225,046 手。当日整体市场增仓3.4万余手。从盘后交易所持仓来看，两大主力多头金鹏期货和成都倍特期货略微增几百手，继续保持多头前两名位置，而主力多头新湖期货增仓3344手，值得注意的是，永安期货昨日空翻多，增加多仓1837手，其多头持仓增加至7021手，而净持仓增加至1813 手；空头两大主力则继续大幅增仓，其中浙江大地增仓2522手至17294手，银河期货增仓1075手至7086手。与此同时，东京商品交易所橡胶期货也强势上扬，基准4月合约再创13个月新高。截止北京时间昨日下午16点46分报241.5日元/公斤，较前日收盘涨3.2日元。金鹏期货北京海鹰路营业部总经理陈旭指出，近期沪胶受资金推动持续升创年内新高，而橡胶现货需求强劲，但供应却因主产国降雨天气而紧张。同时国内有望出台新汽车刺激方案，因此沪胶后市有望延续强势。泰国橡胶协会秘书长Prapas Euanontat16日表示，因暴雨中断生产，2009年该国橡胶产量可能下降约10%，为270万吨至280万吨。另据日本橡胶贸易协会最新数据，截至11月10日，该国天然橡胶库存较10月31日时的库存量下滑3.4%，至3902吨，创纪录新低。据国家统计局公布的最新数据显示，9月份国内轮胎产量较2008年同期增长27%至5,810万条，较8月份增长10%。1-9月份轮胎总产量增长13%至4.814亿条。这表明在特保案发生前，中国的轮胎出口已经产生巨大的需求，特保案生效也可能不会太大地削弱市场规模。陈旭表示，国家仍将汽车行业作为拉动经济增长的重要手段，这可能会在近期即将召开的经济会议中得到体现，中国扩大内需的方针正刺激天胶等原材料消费，引起贸易商囤积库存。不过，也有分析师表示，国内橡胶库存高企，逼近13万吨，且随着主产国降雨天气结束供应将持续增加，因此沪胶后市上行空间有限。"
财经,银行系基金新军崭露头角刚刚过去的2009年，基金市场为基民贡献了一份不错的成绩单。作为银行系基金公司的新军，民生加银基金公司旗下的两只基金崭露头角。WIND数据统计显示，民生蓝筹混合型基金作为民生加银旗下首只基金，截至2009年底累计回报率达到23.7%。A股市场2009年下半年以来震荡剧烈，该基金提前布局消费、医药、化工、有色、煤炭等行业。2009年下半年以来，民生蓝筹基金获得了17.08%的正收益，同期业绩比较基准涨幅为8.69%，跑赢业绩比较基准达8.39个百分点。（易非）   已有_COUNT_条评论  我要评论
财经,美国最近一周原油库存增加220万桶文华财经(综合编译 楼怡婷)--据纽约9月21日消息，美国石油协会(API)周二公布的周度数据显示，美国原油库存上周意外增加，因进口增加，尽管Enbridge石油管道公司的一条主要输油管道关闭。9月17日止当周，美国原油库存增加220万桶，因每日进口量增加31.3万桶至922万桶。分析师此前预计库存下滑190万桶，此前因泄露问题，Enbridge关闭了日输油能力为67万桶的6A号管线，该管线运送加拿大原油至美国精炼厂及俄克拉荷马州库欣的储油中心。该管线于9月9日-17日关闭。API公布，美国最近一周汽油库存增加240万桶，而分析师此前预估为减少30万桶。包括取暖油及柴油在内的馏分油库存增加250万桶，预估为增加20万桶。API称，上周，位于NYMEX原油交割地--俄克拉荷马州库欣的原油库存减少21.9万桶。炼厂产能利用率下滑0.2%至85.4%。欢迎发表评论  我要评论
财经,NYMEX原油期货电子盘持稳在75美元下方文华财经(编辑整理 王欣)--据新加坡9月23日消息，油价周四持稳在每桶75美元下方，先前政府公布的数据显示，美国原油和汽油库存意外增加。尽管加拿大至美国最大的输油管线关闭长达一周，但上周库存依旧上扬，确认了市场的看法，亦即油价今年剩余时间内将大多在石油输出国组织(OPEC)乐见的水准70-80美元间波动。OPEC成员国利比亚的官员周三表示，OPEC在下月的会议上应会维持产出目标不变，并提高减产达成率。欢迎发表评论  我要评论
财经,"亚洲燃料油裂解价差收窄 跨月合约仍遭大单抛售文华财经(编辑整理 何丽丽)--据新加坡9月23日消息，亚洲燃料油跨月合约周四仍遭大单抛售，约有27.5万吨10/11月和11/12月跨月合约以疲弱的价格成交。10月粘度差收窄至一周前成为即期合约以来最低水准，交投量很大。交易商称，跨月价差处于关键点，可能进一步走软或者快速反弹。1130GMT,10/11月和11/12月跨月合约至少分别有11.5万吨和16万吨，分别以每吨正价差4.00-4.20美元和3.50-3.75美元成交。0830GMT收盘时，10/11月互换正价差持稳於每吨4.00美元。11/12月互换正价差下跌0.13美元，至每吨正价差3.63美元。10月燃料油裂解价差收窄0.26美元，至每桶较迪拜原油贴水6.15美元。11月裂解价差收窄0.23美元，至每桶贴水6.00美元。180CST燃料油价格下跌2.00美元至每吨444.75美元；380CST燃料油价格跌1.50美元至每吨439.88美元。油品                      价格        上日价格     变动现货180CST燃料油       444.50/445.00      446.75    -2.00现货380CST燃料油       439.50/439.75      441.13    -1.5010月燃料油互换                446.25      449.13    -2.8811月燃料油互换                450.38      453.13    -2.75新加坡船用燃料油       439.00/441.00      442.00    -2.00380CST船用燃料油升水       0.18/0.58        0.87    -0.50欢迎发表评论  我要评论"
